{
  "personalInfo": {
    "fullName": "Brian (Guanghui) Sun",
    "preferredName": "Brian Sun",
    "title": "Certified Senior Data Scientist | Analytics Lead",
    "location": {
      "city": "Greater Toronto Area",
      "province": "ON",
      "country": "Canada"
    },
    "pronouns": "he/him",
    "languages": [
      {
        "language": "English",
        "proficiency": "Fluent"
      },
      {
        "language": "Mandarin Chinese",
        "proficiency": "Native"
      }
    ]
  },
  "summary": {
    "professionalSummary": "Certified Senior Data Scientist, accredited by the Data Science Council of America (DASCA), and former Technical AI Ambassador at HSBC, with over 10 years of experience leading AI, machine learning, data science and advanced analytics initiatives, primarily in the financial sector. Demonstrated success in fraud mitigation, risk management, client service operation, and marketing optimization, delivering data-driven solutions that improve decision-making and operational efficiency. Now ready to leverage strong analytical skills and technical leadership experience to create value for future employers after a career break due to family relocation."
  },
  "coreCompetencies": {
    "competencies": [
      {
        "name": "Analytics Solution Architect",
        "yearsExperience": 10
      },
      {
        "name": "Data Science",
        "yearsExperience": 10
      },
      {
        "name": "LLM",
        "yearsExperience": 3
      },
      {
        "name": "Agentic AI",
        "yearsExperience": 2
      },
      {
        "name": "Machine Learning",
        "yearsExperience": 10
      },
      {
        "name": "Predictive Modeling",
        "yearsExperience": 10
      },
      {
        "name": "MLOps",
        "yearsExperience": 5
      },
      {
        "name": "CI/CD",
        "yearsExperience": 5
      },
      {
        "name": "Cloud Platform",
        "yearsExperience": 6
      },
      {
        "name": "Data Modeling",
        "yearsExperience": 10
      },
      {
        "name": "ETL",
        "yearsExperience": 8
      },
      {
        "name": "Data Pipeline",
        "yearsExperience": 8
      },
      {
        "name": "Business Intelligence",
        "yearsExperience": 10
      },
      {
        "name": "Data Visualization",
        "yearsExperience": 10
      },
      {
        "name": "Data Management",
        "yearsExperience": 10
      },
      {
        "name": "Team Leadership",
        "yearsExperience": 8
      },
      {
        "name": "Agile/Scrum",
        "yearsExperience": 6
      },
      {
        "name": "Data Storytelling",
        "yearsExperience": 10
      },
      {
        "name": "Business Presentation",
        "yearsExperience": 10
      }
    ]
  },
  "workExperience": {
    "positions": [
      {
        "title": "Senior Data Scientist",
        "company": "HSBC",
        "location": "Toronto, ON, Canada",
        "startDate": "2022-05-01",
        "endDate": "2024-08-31",
        "isCurrent": false,
        "description": "Spearheaded AI and data science innovation initiatives focused on HSBC global wholesale banking business in fraud risk mitigation, workforce management, and client service operations.",
        "achievements": [
          {
            "title": "GenAI Solution for Suspicious Fraud Case Review",
            "description": "Initiated and led the generative AI agent development for assisting the fraud case review report generation, boosting team productivity by reducing up to 35% case review processing time",
            "technologies": ["Generative AI", "Machine Learning", "Natural Language Processing"]
          },
          {
            "title": "Explainable AI Solution for Loan Fraud Mitigation",
            "description": "Engineered the Explainable Artificial Intelligence solution, which integrated ML model with expert decision model, for 1st party lending fraud mitigation, increasing detection accuracy by 30+% and averting annual fraud losses up to $100 million globally",
            "technologies": ["Explainable AI", "Machine Learning", "Expert Systems"]
          },
          {
            "title": "Automated Demand Forecast Engine",
            "description": "Automated the training and maintenance of 1000+ Meta Prophet forecasting models, boosting demand forecasting accuracy by 60% for wholesale client service",
            "technologies": ["Meta Prophet", "Time Series Analysis", "Automation"]
          },
          {
            "title": "Machine Learning Solution for Workforce Management",
            "description": "Pioneered the integration of machine learning algorithms to develop personalized performance benchmarks based on workload, case complexity, and experience, enhancing evaluation equity and boosting client manager productivity",
            "technologies": ["Machine Learning", "Performance Analytics", "Workforce Management"]
          }
        ]
      },
      {
        "title": "VP of Analytics",
        "company": "HSBC",
        "location": "Toronto, ON, Canada",
        "startDate": "2019-11-01",
        "endDate": "2022-04-30",
        "isCurrent": false,
        "description": "Managed a team of data scientists and data analysts, supporting HSBC global retail banking business.",
        "achievements": [
          {
            "title": "Machine Learning Solution for Credit Card Application Fraud Detection",
            "description": "Championed the development of a real-time machine learning solution for credit card fraud detection, reducing fraud losses by $0.8 million USD in 2021",
            "technologies": ["Machine Learning", "Real-time Processing", "Fraud Detection"]
          },
          {
            "title": "Marketing Optimization by Machine Learning",
            "description": "Revamped marketing campaigns by A/B test and machine learning algorithm, resulting in a 5x increase in conversion rates",
            "technologies": ["Machine Learning", "A/B Testing", "Marketing Analytics"]
          },
          {
            "title": "Intelligent COVID-19 Risk Management Tool",
            "description": "Initialized and led the Intelligence system development for COVID-19 risk management, winning the Best Alliance award of Global Service Elite 2020",
            "technologies": ["Risk Management", "Intelligence Systems", "COVID-19 Analytics"]
          }
        ]
      },
      {
        "title": "Big Data Engineering Lead",
        "company": "CRCBank",
        "location": "China",
        "startDate": "2018-03-01",
        "endDate": "2019-08-31",
        "isCurrent": false,
        "description": "Led big data engineering initiatives and data governance architecture development.",
        "achievements": [
          {
            "title": "Data Governance Architecture Development",
            "description": "Pioneered data governance architecture development, cleansing 2000+ tables (3TB) across 10 bank systems, enhancing analytics efficiency",
            "technologies": ["Data Governance", "Data Cleansing", "Big Data"]
          },
          {
            "title": "KPI Dashboards and Risk Control System",
            "description": "Led the development of 30+ operational and financial KPI dashboards, and designed and implemented credit and fraud strategies, establishing a data-driven risk control system for post-loan risk monitoring",
            "technologies": ["Dashboard Development", "KPI Analytics", "Risk Management"]
          }
        ]
      },
      {
        "title": "Risk Data Science Lead",
        "company": "Mashang Consumer Finance Ltd",
        "location": "China",
        "startDate": "2017-05-01",
        "endDate": "2018-03-31",
        "isCurrent": false,
        "description": "Led risk data science initiatives for consumer finance operations.",
        "achievements": [
          {
            "title": "Fraud Strategy Development for POS Loans",
            "description": "Spearheaded the fraud strategy development for POS loans, resulting in 26% reduction of fraud loss",
            "technologies": ["Fraud Detection", "Risk Modeling", "POS Analytics"]
          },
          {
            "title": "Machine Learning Based Risk Model Development",
            "description": "Led the machine learning based risk model development, supporting the consumer loan risk management",
            "technologies": ["Machine Learning", "Risk Modeling", "Consumer Finance"]
          }
        ]
      },
      {
        "title": "Payment Data Analytics Lead",
        "company": "Vipshop Ltd",
        "location": "China",
        "startDate": "2016-10-01",
        "endDate": "2017-04-30",
        "isCurrent": false,
        "description": "Led payment data analytics and fraud detection initiatives for e-commerce platform.",
        "achievements": [
          {
            "title": "Fraud Detection ML Models",
            "description": "Championed the development of fraud detection ML models, enhancing online transaction security",
            "technologies": ["Machine Learning", "Fraud Detection", "Payment Analytics"]
          },
          {
            "title": "Marketing Campaign Optimization",
            "description": "Led the machine learning initiatives that optimized marketing campaigns, increasing adoption by 30% and reducing marketing costs by 15%",
            "technologies": ["Machine Learning", "Marketing Analytics", "Campaign Optimization"]
          }
        ]
      },
      {
        "title": "Senior Manager of Analytics Consulting",
        "company": "Fair Isaac Corporation",
        "location": "United States",
        "startDate": "2015-09-01",
        "endDate": "2016-09-30",
        "isCurrent": false,
        "description": "Led a team of analytics consultants in developing analytics solutions for diverse risk consulting projects.",
        "achievements": [
          {
            "title": "Analytics Solutions Development",